### ISSUE TITLE
Does it work with NAT?

### ISSUE THREAD

**Issue by chelaxian** [TrustTunnel/TrustTunnel#37]
i can't make it work on Oracle VPS (arm64). Works perfectly on Aeza bare-metal (no Proxmox/LXC/NAT) with identical config.

**Setup:**
- VPS: Oracle ARM64, Proxmox VE, 4 public IPs
- Endpoint in LXC container: 1 IP fully NATed (SNAT+DNAT on PVE host)
- iptables on host+LXC with MASQUERADE for all traffic

**Server config** (all settings are default): 
- Endpoint binary: trusttunnel_endpoint (latest release)
- listen_address = "0.0.0.0:443"
- Certificate: Let's Encrypt with DNS challenge method
- 3 additional SNI
- 2 user credentials
- ipv6_available = true
- allow_private_network_connections = false
- forward_protocol = "direct"
- listen_protocols: http1 + http2 + quic
- credentials_file / rules_file loaded successfully

**Client**: iOS TrustTunnel app
Protocol: HTTP/2
Auth: Basic (username/password, works)

**Problem**:
- iOS Client connects to endpoint and reports VPN as “connected”
- TLS and HTTP/2 handshakes look successful
- Endpoint establishes outbound TCP connections (e.g. to GitHub CDN, Telegram, Google DNS)
- tcpdump on LXC endpoint and PVE host shows bidirectional TCP and UDP traffic (in/out ~equal)
- However, iOS still has no Internet connectivity while VPN is enabled (neither DNS or IP not accessible) 

**Suspect**: LXC NAT breaks QUIC UDP return path/MTU? Any known LXC/Proxmox issues?

Relevant endpoint log fragment (TLS + HTTP/2 + CONNECT):

```bash
[...]
145915.0913 DEBUG trusttunnel_core CLIENTxxxx New TLS client TlsStream io PrebufferedTcpStream [...]
145915.0914 TRACE trusttunnel_core CLIENTxxxx Routing to channel Tunnel
145915.0916 TRACE trusttunnel_http2_codec CLIENTxxxx H2 handshake in progress
145915.0917 TRACE trusttunnel_http2_codec CLIENTxxxx H2 connection established
145915.0918 TRACE trusttunnel_http2_codec CLIENTxxxx H2 waiting for stream
145915.0919 DEBUG trusttunnel_http2_codec CLIENTxxxxCONN0 H2 stream accepted, streamid StreamId(1)
145915.0920 TRACE trusttunnel_http_downstream CLIENTxxxxCONN0 HTTP downstream received request CONNECT 185.199.108.133:443
145915.0920 DEBUG trusttunnel_http_downstream CLIENTxxxxCONN0 Received request Parts { method = CONNECT, uri = 185.199.108.133:443, version = HTTP/2.0, headers = { user-agent: "iOS trusttunnel_client", proxy-authorization: <scrubbed> } }
145915.0921 TRACE trusttunnel_tunnel CLIENTxxxxCONN0 Handling TCP connect request
145915.0922 TRACE trusttunnel_tcp_forwarder CLIENTxxxxCONN0 Connecting to peer 185.199.108.133:443
145915.0930 TRACE trusttunnel_tcp_forwarder CLIENTxxxxCONN0 Connection established, local port <redacted>
145915.0931 DEBUG trusttunnel_tunnel CLIENTxxxxCONN0 Successfully connected to TcpConnectionMeta { client_address: 10.200.0.1, destination: 185.199.108.133:443, tls_domain: "<endpoint-domain>", user_agent: "iOS trusttunnel_client" }
145915.0931 TRACE trusttunnel_http2_codec CLIENTxxxxCONN0 H2 sending response status 200 OK
145915.0932 TRACE trusttunnel_tunnel CLIENTxxxxCONN0 TCP connect pipe exchange started
145915.2498 TRACE trusttunnel_http2_codec CLIENTxxxxCONN0 H2 stream read 517 bytes
145915.2499 TRACE trusttunnel_pipe CLIENTxxxxCONN0 -- TCP data Chunk(517 bytes)
145915.2529 TRACE trusttunnel_pipe CLIENTxxxxCONN0 -- TCP data Chunk(1444 bytes)
145915.2530 TRACE trusttunnel_http2_codec CLIENTxxxxCONN0 H2 stream wrote 1444/1444 bytes
145915.2532 TRACE trusttunnel_pipe CLIENTxxxxCONN0 -- TCP data Chunk(4459 bytes)
145915.2533 TRACE trusttunnel_http2_codec CLIENTxxxxCONN0 H2 stream wrote 4459/4459 bytes
[...]
```
UDP/DNS over HTTP/2 also looks fine:
```bash
[...]
145929.3961 DEBUG trusttunnel_http2_codec CLIENTyyyyTUNzzzCONN1 H2 stream accepted, streamid StreamId(3)
145929.3962 TRACE trusttunnel_http_downstream CLIENTyyyyTUNzzzCONN1 HTTP downstream received request CONNECT udp2
145929.3963 DEBUG trusttunnel_http_downstream CLIENTyyyyTUNzzzCONN1 Received request Parts { method = CONNECT, uri = "udp2", version = HTTP/2.0, headers = { user-agent: "iOS udp2", proxy-authorization: <scrubbed> } }
145929.3964 TRACE trusttunnel_tunnel CLIENTyyyyTUNzzzCONN1 Handling datagram multiplexer request
145929.3965 TRACE trusttunnel_http2_codec CLIENTyyyyTUNzzzCONN1 H2 sending response status 200 OK
145929.3968 TRACE trusttunnel_http2_codec CLIENTyyyyTUNzzzCONN1 H2 stream read 72 bytes
145929.3968 TRACE trusttunnel_udp_pipe CLIENTyyyyTUNzzzCONN1 -- Datagram meta UdpDatagramMeta { source: 127.0.0.1:xxxxx, destination: 8.8.4.4:53, app_name: Some(..), payload_len: 31 }
145929.3971 TRACE trusttunnel_udp_pipe CLIENTyyyyTUNzzzCONN1 -- Datagram meta UdpDatagramMeta { source: 8.8.4.4:53, destination: 127.0.0.1:xxxxx, payload_len: 63 }
145929.3972 DEBUG trusttunnel_udp_pipe CLIENTyyyyTUNzzzCONN1CONN0 All UDP queries are completed
[...]
```
tcpdump on the endpoint (container interface) during one HTTPS test:

```bash
# tcpdump -i any proto 6 and port 443
<container-if> In  IP <client-tun-ip>.xxxxx > endpoint.dns.google.https: Flags [S], seq ..., win 65535, options [mss 1400,sackOK,...], length 0
<container-if> Out IP endpoint.dns.google.https > <client-tun-ip>.xxxxx: Flags [S.], seq ..., ack ..., win 65160, options [mss 1460,sackOK,...], length 0
<container-if> In  IP <client-tun-ip>.xxxxx > endpoint.dns.google.https: Flags [.], ack 1, win 2060, length 0
<container-if> In  IP <client-tun-ip>.xxxxx > endpoint.dns.google.https: Flags [P.], seq 1:641, ack 1, win 2060, length 640   # client → endpoint
<container-if> Out IP endpoint.dns.google.https > <client-tun-ip>.xxxxx: Flags [.], ack 641, win 505, length 0
<container-if> Out IP endpoint.dns.google.https > <client-tun-ip>.xxxxx: Flags [P.], seq 1:2066, ack 641, win 505, length 2065  # endpoint → client
<container-if> In  IP <client-tun-ip>.xxxxx > endpoint.dns.google.https: Flags [.], ack 2066, win 2048, length 0
[... many similar ACK/PUSH packets in both directions ...]
```

So from my point of view:
- TLS handshake succeeds
- HTTP/2 transport works
- CONNECT to external hosts succeeds and real data flows both ways
- DNS over UDP through the tunnel also succeeds

But the iOS client still reports “no Internet” when this server is selected (other TrustTunnel servers work fine with the same client).

Any ideas what I might be missing, or what extra debug info I can collect to help you reproduce?

**Comment by gettheworkdone** [comment]
@chelaxian , I have the same issue. Did you solve that?

**Comment by chelaxian** [comment]
> [@chelaxian](https://github.com/chelaxian) , I have the same issue. Did you solve that?

no :(

**Comment by workingBanana** [comment]
Hello @chelaxian,
In release 1.2 of trusttunnel-client we added a log export feature. Could you please use it to export the logs from the iOS client, and also export the logs from the endpoint? Please send both to qa@adguard.com and mention this issue in the subject.

Thanks!
